{
  "$schema": "../../registry/block-schema.json",
  "name": "Idempotency",
  "description": "Exactly-once request execution with pluggable stores and cache, plus an Express adapter",
  "version": "1.0.1",
  "releasedAt": "2026-08-16",
  "runtimes": {
    "node": ">=20"
  },
  "related": ["rate-limiter", "error-handler", "logger"],
  "devDependencies": ["vitest@^4.1.11", "@types/node@^26.2.0"],
  "baseFiles": [
    {
      "source": "blocks/idempotency/index.ts",
      "target": "index.ts"
    },
    {
      "source": "blocks/idempotency/core/idempotency-handler.ts",
      "target": "core/idempotency-handler.ts"
    },
    {
      "source": "blocks/idempotency/core/idempotency-handler.test.ts",
      "target": "core/idempotency-handler.test.ts"
    },
    {
      "source": "blocks/idempotency/core/core.test.ts",
      "target": "core/core.test.ts"
    },
    {
      "source": "blocks/idempotency/errors/codes.ts",
      "target": "errors/codes.ts"
    },
    {
      "source": "blocks/idempotency/errors/idempotency-errors.ts",
      "target": "errors/idempotency-errors.ts"
    },
    {
      "source": "blocks/idempotency/interfaces/cache.ts",
      "target": "interfaces/cache.ts"
    },
    {
      "source": "blocks/idempotency/interfaces/logger.ts",
      "target": "interfaces/logger.ts"
    },
    {
      "source": "blocks/idempotency/interfaces/observability.ts",
      "target": "interfaces/observability.ts"
    },
    {
      "source": "blocks/idempotency/interfaces/store.ts",
      "target": "interfaces/store.ts"
    },
    {
      "source": "blocks/idempotency/types/index.ts",
      "target": "types/index.ts"
    },
    {
      "source": "blocks/idempotency/services/cache-manager.ts",
      "target": "services/cache-manager.ts"
    },
    {
      "source": "blocks/idempotency/services/cache-manager.test.ts",
      "target": "services/cache-manager.test.ts"
    },
    {
      "source": "blocks/idempotency/jobs/record-cleaner.ts",
      "target": "jobs/record-cleaner.ts"
    },
    {
      "source": "blocks/idempotency/jobs/record-cleaner.test.ts",
      "target": "jobs/record-cleaner.test.ts"
    },
    {
      "source": "blocks/idempotency/jobs/record-recovery.ts",
      "target": "jobs/record-recovery.ts"
    },
    {
      "source": "blocks/idempotency/jobs/record-recovery.test.ts",
      "target": "jobs/record-recovery.test.ts"
    },
    {
      "source": "blocks/idempotency/utils/constant-time-equals.ts",
      "target": "utils/constant-time-equals.ts"
    },
    {
      "source": "blocks/idempotency/utils/constant-time-equals.test.ts",
      "target": "utils/constant-time-equals.test.ts"
    },
    {
      "source": "blocks/idempotency/utils/create-logger.ts",
      "target": "utils/create-logger.ts"
    },
    {
      "source": "blocks/idempotency/utils/key-validator.ts",
      "target": "utils/key-validator.ts"
    },
    {
      "source": "blocks/idempotency/utils/key-validator.test.ts",
      "target": "utils/key-validator.test.ts"
    },
    {
      "source": "blocks/idempotency/utils/serializer.ts",
      "target": "utils/serializer.ts"
    },
    {
      "source": "blocks/idempotency/utils/serializer.test.ts",
      "target": "utils/serializer.test.ts"
    },
    {
      "source": "blocks/idempotency/adapters/shared.ts",
      "target": "adapters/shared.ts"
    }
  ],
  "adapters": {
    "express": {
      "dependencies": ["express@^5.3.0"],
      "devDependencies": ["@types/express@^5.0.6", "supertest@^7.2.2", "@types/supertest@^7.2.1"],
      "variants": {
        "default": {
          "files": [
            {
              "source": "blocks/idempotency/adapters/express.ts",
              "target": "adapters/express.ts"
            },
            {
              "source": "blocks/idempotency/adapters/express.test.ts",
              "target": "adapters/express.test.ts"
            },
            {
              "source": "blocks/idempotency/adapters/express.integration.test.ts",
              "target": "adapters/express.integration.test.ts"
            },
            {
              "source": "blocks/idempotency/adapters/express.security.test.ts",
              "target": "adapters/express.security.test.ts"
            }
          ]
        }
      }
    },
    "fastify": {
      "dependencies": ["fastify@^5.12.7"],
      "devDependencies": ["vitest@^4.1.11"],
      "variants": {
        "default": {
          "files": [
            {
              "source": "blocks/idempotency/adapters/fastify.ts",
              "target": "adapters/fastify.ts"
            },
            {
              "source": "blocks/idempotency/adapters/fastify.test.ts",
              "target": "adapters/fastify.test.ts"
            },
            {
              "source": "blocks/idempotency/adapters/fastify.integration.test.ts",
              "target": "adapters/fastify.integration.test.ts"
            }
          ]
        }
      }
    },
    "hono": {
      "dependencies": ["hono@^4.13.5"],
      "devDependencies": ["vitest@^4.1.11"],
      "variants": {
        "default": {
          "files": [
            {
              "source": "blocks/idempotency/adapters/hono.ts",
              "target": "adapters/hono.ts"
            },
            {
              "source": "blocks/idempotency/adapters/hono.test.ts",
              "target": "adapters/hono.test.ts"
            },
            {
              "source": "blocks/idempotency/adapters/hono.integration.test.ts",
              "target": "adapters/hono.integration.test.ts"
            }
          ]
        }
      }
    }
  }
}
