{
  "$schema": "../../registry/block-schema.json",
  "name": "Rate Limiter",
  "description": "IP-based rate limiting middleware with pluggable storage strategies",
  "version": "1.0.2",
  "releasedAt": "2026-06-27",
  "runtimes": {
    "node": ">=20"
  },
  "related": ["idempotency", "logger", "error-handler"],
  "devDependencies": ["vitest@^4.1.11"],
  "baseFiles": [
    {
      "source": "blocks/rate-limiter/core/core.ts",
      "target": "core/core.ts"
    },
    {
      "source": "blocks/rate-limiter/utils/ip.ts",
      "target": "utils/ip.ts"
    },
    {
      "source": "blocks/rate-limiter/utils/ip.test.ts",
      "target": "utils/ip.test.ts"
    }
  ],
  "adapters": {
    "express": {
      "dependencies": ["express@^5.3.0"],
      "devDependencies": ["@types/express@^5.0.6", "supertest@^7.2.2", "@types/supertest@^7.2.1"],
      "variants": {
        "memory": {
          "devDependencies": ["vitest@^4.1.11"],
          "files": [
            {
              "source": "blocks/rate-limiter/adapters/express.ts",
              "target": "adapters/express.ts"
            },
            {
              "source": "blocks/rate-limiter/adapters/express.test.ts",
              "target": "adapters/express.test.ts"
            },
            {
              "source": "blocks/rate-limiter/variants/memory-store.ts",
              "target": "variants/memory-store.ts"
            },
            {
              "source": "blocks/rate-limiter/variants/store.test.ts",
              "target": "variants/memory-store.test.ts"
            }
          ]
        },
        "redis": {
          "dependencies": ["ioredis@^5.11.1"],
          "devDependencies": ["vitest@^4.1.11", "dotenv@^18.0.2"],
          "files": [
            {
              "source": "blocks/rate-limiter/adapters/express.ts",
              "target": "adapters/express.ts"
            },
            {
              "source": "blocks/rate-limiter/adapters/express.test.ts",
              "target": "adapters/express.test.ts"
            },
            {
              "source": "blocks/rate-limiter/variants/redis-store.ts",
              "target": "variants/redis-store.ts"
            },
            {
              "source": "blocks/rate-limiter/variants/redis.test.ts",
              "target": "variants/redis-store.test.ts"
            },
            {
              "source": "blocks/rate-limiter/variants/redis-store-record-mapping.test.ts",
              "target": "variants/redis-store-record-mapping.test.ts"
            },
            {
              "source": "blocks/rate-limiter/variants/redis-store.integration.test.ts",
              "target": "variants/redis-store.integration.test.ts"
            }
          ]
        }
      }
    },
    "fastify": {
      "dependencies": ["fastify@^5.12.7"],
      "variants": {
        "memory": {
          "devDependencies": ["vitest@^4.1.11"],
          "files": [
            {
              "source": "blocks/rate-limiter/adapters/fastify.ts",
              "target": "adapters/fastify.ts"
            },
            {
              "source": "blocks/rate-limiter/adapters/fastify.test.ts",
              "target": "adapters/fastify.test.ts"
            },
            {
              "source": "blocks/rate-limiter/variants/memory-store.ts",
              "target": "variants/memory-store.ts"
            },
            {
              "source": "blocks/rate-limiter/variants/store.test.ts",
              "target": "variants/memory-store.test.ts"
            }
          ]
        },
        "default": {
          "devDependencies": ["vitest@^4.1.11"],
          "files": [
            {
              "source": "blocks/rate-limiter/adapters/fastify.ts",
              "target": "adapters/fastify.ts"
            },
            {
              "source": "blocks/rate-limiter/adapters/fastify.test.ts",
              "target": "adapters/fastify.test.ts"
            },
            {
              "source": "blocks/rate-limiter/variants/memory-store.ts",
              "target": "variants/memory-store.ts"
            },
            {
              "source": "blocks/rate-limiter/variants/store.test.ts",
              "target": "variants/memory-store.test.ts"
            }
          ]
        },
        "redis": {
          "dependencies": ["ioredis@^5.11.1"],
          "devDependencies": ["vitest@^4.1.11", "dotenv@^18.0.2"],
          "files": [
            {
              "source": "blocks/rate-limiter/adapters/fastify.ts",
              "target": "adapters/fastify.ts"
            },
            {
              "source": "blocks/rate-limiter/adapters/fastify.test.ts",
              "target": "adapters/fastify.test.ts"
            },
            {
              "source": "blocks/rate-limiter/variants/redis-store.ts",
              "target": "variants/redis-store.ts"
            },
            {
              "source": "blocks/rate-limiter/variants/redis.test.ts",
              "target": "variants/redis-store.test.ts"
            },
            {
              "source": "blocks/rate-limiter/variants/redis-store-record-mapping.test.ts",
              "target": "variants/redis-store-record-mapping.test.ts"
            },
            {
              "source": "blocks/rate-limiter/variants/redis-store.integration.test.ts",
              "target": "variants/redis-store.integration.test.ts"
            }
          ]
        }
      }
    },
    "hono": {
      "dependencies": ["hono@^4.13.5"],
      "variants": {
        "memory": {
          "devDependencies": ["vitest@^4.1.11"],
          "files": [
            {
              "source": "blocks/rate-limiter/adapters/hono.ts",
              "target": "adapters/hono.ts"
            },
            {
              "source": "blocks/rate-limiter/adapters/hono.test.ts",
              "target": "adapters/hono.test.ts"
            },
            {
              "source": "blocks/rate-limiter/variants/memory-store.ts",
              "target": "variants/memory-store.ts"
            },
            {
              "source": "blocks/rate-limiter/variants/store.test.ts",
              "target": "variants/memory-store.test.ts"
            }
          ]
        },
        "default": {
          "devDependencies": ["vitest@^4.1.11"],
          "files": [
            {
              "source": "blocks/rate-limiter/adapters/hono.ts",
              "target": "adapters/hono.ts"
            },
            {
              "source": "blocks/rate-limiter/adapters/hono.test.ts",
              "target": "adapters/hono.test.ts"
            },
            {
              "source": "blocks/rate-limiter/variants/memory-store.ts",
              "target": "variants/memory-store.ts"
            },
            {
              "source": "blocks/rate-limiter/variants/store.test.ts",
              "target": "variants/memory-store.test.ts"
            }
          ]
        },
        "redis": {
          "dependencies": ["ioredis@^5.11.1"],
          "devDependencies": ["vitest@^4.1.11", "dotenv@^18.0.2"],
          "files": [
            {
              "source": "blocks/rate-limiter/adapters/hono.ts",
              "target": "adapters/hono.ts"
            },
            {
              "source": "blocks/rate-limiter/adapters/hono.test.ts",
              "target": "adapters/hono.test.ts"
            },
            {
              "source": "blocks/rate-limiter/variants/redis-store.ts",
              "target": "variants/redis-store.ts"
            },
            {
              "source": "blocks/rate-limiter/variants/redis.test.ts",
              "target": "variants/redis-store.test.ts"
            },
            {
              "source": "blocks/rate-limiter/variants/redis-store-record-mapping.test.ts",
              "target": "variants/redis-store-record-mapping.test.ts"
            },
            {
              "source": "blocks/rate-limiter/variants/redis-store.integration.test.ts",
              "target": "variants/redis-store.integration.test.ts"
            }
          ]
        }
      }
    }
  },
  "environments": {
    "*": {
      "variants": {
        "memory": {
          "files": [
            {
              "source": "blocks/rate-limiter/variants/memory-store.ts",
              "target": "variants/memory-store.ts"
            }
          ]
        },
        "redis": {
          "dependencies": ["ioredis@^5.11.1"],
          "devDependencies": ["vitest@^4.1.11"],
          "files": [
            {
              "source": "blocks/rate-limiter/variants/redis-store.ts",
              "target": "variants/redis-store.ts"
            },
            {
              "source": "blocks/rate-limiter/variants/redis.test.ts",
              "target": "variants/redis.test.ts"
            }
          ]
        }
      }
    }
  }
}
