{
  "$schema": "../../registry/block-schema.json",
  "name": "Request Validator",
  "description": "Framework-agnostic request validation powered by Zod.",
  "version": "1.0.1",
  "releasedAt": "2026-07-03",
  "runtimes": {
    "node": ">=20"
  },
  "related": ["error-handler", "response-formatter"],
  "dependencies": ["zod@^4.4.3"],
  "devDependencies": ["vitest@^4.1.11"],
  "baseFiles": [
    {
      "source": "blocks/request-validator/core.ts",
      "target": "core.ts"
    },
    {
      "source": "blocks/request-validator/contract.ts",
      "target": "contract.ts"
    },
    {
      "source": "blocks/request-validator/core.test.ts",
      "target": "core.test.ts"
    }
  ],
  "adapters": {
    "express": {
      "dependencies": ["express@^5.3.0"],
      "devDependencies": ["@types/express@^5.0.6", "supertest@^7.2.2", "@types/supertest@^7.2.1"],
      "variants": {
        "default": {
          "files": [
            {
              "source": "blocks/request-validator/adapters/express.ts",
              "target": "adapters/express.ts"
            },
            {
              "source": "blocks/request-validator/adapters/express.test.ts",
              "target": "adapters/express.test.ts"
            }
          ]
        }
      }
    },
    "hono": {
      "dependencies": ["hono@^4.13.5"],
      "devDependencies": ["vitest@^4.1.11"],
      "variants": {
        "default": {
          "files": [
            {
              "source": "blocks/request-validator/adapters/hono.ts",
              "target": "adapters/hono.ts"
            },
            {
              "source": "blocks/request-validator/adapters/hono.test.ts",
              "target": "adapters/hono.test.ts"
            }
          ]
        }
      }
    },
    "fastify": {
      "dependencies": ["fastify@^5.12.7"],
      "devDependencies": ["vitest@^4.1.11"],
      "variants": {
        "default": {
          "files": [
            {
              "source": "blocks/request-validator/adapters/fastify.ts",
              "target": "adapters/fastify.ts"
            },
            {
              "source": "blocks/request-validator/adapters/fastify.test.ts",
              "target": "adapters/fastify.test.ts"
            }
          ]
        }
      }
    }
  }
}
