{
  "$schema": "../../registry/block-schema.json",
  "name": "Graceful Shutdown",
  "description": "Dependency-free graceful shutdown with in-flight request draining and per-framework adapters",
  "version": "1.0.1",
  "releasedAt": "2026-08-07",
  "runtimes": {
    "node": ">=20"
  },
  "related": ["health-check", "logger"],
  "devDependencies": ["vitest@^4.1.11", "@types/node@^26.2.0"],
  "baseFiles": [
    {
      "source": "blocks/graceful-shutdown/index.ts",
      "target": "index.ts"
    },
    {
      "source": "blocks/graceful-shutdown/constants.ts",
      "target": "constants.ts"
    },
    {
      "source": "blocks/graceful-shutdown/types.ts",
      "target": "types.ts"
    },
    {
      "source": "blocks/graceful-shutdown/core/shutdown.ts",
      "target": "core/shutdown.ts"
    },
    {
      "source": "blocks/graceful-shutdown/core/connection-tracker.ts",
      "target": "core/connection-tracker.ts"
    },
    {
      "source": "blocks/graceful-shutdown/utils/index.ts",
      "target": "utils/index.ts"
    },
    {
      "source": "blocks/graceful-shutdown/utils/http.ts",
      "target": "utils/http.ts"
    },
    {
      "source": "blocks/graceful-shutdown/utils/state.ts",
      "target": "utils/state.ts"
    },
    {
      "source": "blocks/graceful-shutdown/utils/timeout.ts",
      "target": "utils/timeout.ts"
    },
    {
      "source": "blocks/graceful-shutdown/tests/unit/shutdown.test.ts",
      "target": "tests/unit/shutdown.test.ts"
    },
    {
      "source": "blocks/graceful-shutdown/tests/unit/connection-tracker.test.ts",
      "target": "tests/unit/connection-tracker.test.ts"
    },
    {
      "source": "blocks/graceful-shutdown/tests/unit/http-task.test.ts",
      "target": "tests/unit/http-task.test.ts"
    },
    {
      "source": "blocks/graceful-shutdown/tests/unit/state.test.ts",
      "target": "tests/unit/state.test.ts"
    },
    {
      "source": "blocks/graceful-shutdown/tests/unit/timeout.test.ts",
      "target": "tests/unit/timeout.test.ts"
    }
  ],
  "adapters": {
    "express": {
      "dependencies": ["express@^5.3.0"],
      "devDependencies": ["@types/express@^5.0.6"],
      "variants": {
        "default": {
          "files": [
            {
              "source": "blocks/graceful-shutdown/adapters/express.ts",
              "target": "adapters/express.ts"
            },
            {
              "source": "blocks/graceful-shutdown/tests/integration/express.test.ts",
              "target": "tests/integration/express.test.ts"
            }
          ]
        }
      }
    },
    "fastify": {
      "dependencies": ["fastify@^5.12.7"],
      "variants": {
        "default": {
          "files": [
            {
              "source": "blocks/graceful-shutdown/adapters/fastify.ts",
              "target": "adapters/fastify.ts"
            },
            {
              "source": "blocks/graceful-shutdown/tests/integration/fastify.test.ts",
              "target": "tests/integration/fastify.test.ts"
            }
          ]
        }
      }
    },
    "hono": {
      "dependencies": ["hono@^4.13.5", "@hono/node-server@^2.1.1"],
      "variants": {
        "default": {
          "files": [
            {
              "source": "blocks/graceful-shutdown/adapters/hono.ts",
              "target": "adapters/hono.ts"
            },
            {
              "source": "blocks/graceful-shutdown/tests/integration/hono.test.ts",
              "target": "tests/integration/hono.test.ts"
            }
          ]
        }
      }
    }
  }
}
